{
    "$schema": "http://json-schema.org/draft-06/schema#",
    "$ref": "#/definitions/OurWork",
    "definitions": {
        "OurWork": {
            "type": "object",
            "additionalProperties": false,
            "properties": {
                "puzzleVar": {
                    "type": "string",
                    "format": "integer"
                },
                "username": {
                    "type": "string"
                },
                "headerTitle": {
                    "type": "string"
                },
                "firstParagraph": {
                    "$ref": "#/definitions/Paragraph"
                },
                "secondParagraph": {
                    "$ref": "#/definitions/Paragraph"
                },
                "thirdParagraph": {
                    "$ref": "#/definitions/Paragraph"
                },
                "images": {
                    "$ref": "#/definitions/Images"
                }
            },
            "required": [
                "firstParagraph",
                "headerTitle",
                "images",
                "puzzleVar",
                "secondParagraph",
                "thirdParagraph",
                "username"
            ],
            "title": "OurWork"
        },
        "Paragraph": {
            "title": "FirstParagraph",
            "type": "object",
            "additionalProperties": false,
            "properties": {
                "title": {
                    "type": "string"
                },
                "text": {
                    "type": "string"
                },
                "image": {
                    "$ref": "#/definitions/Image"
                }
            },
            "required": [
                "title",
                "text"
            ]
        },
        "Images": {
            "title": "Images",
            "type": "object",
            "additionalProperties": false,
            "properties": {
                "header": {
                    "$ref": "#/definitions/Image"
                },
                "slideImages": {
                    "type": "array",
                    "items": {
                        "$ref": "#/definitions/Image"
                    }
                },
                "futurePlans": {
                    "type": "array",
                    "items": {
                        "$ref": "#/definitions/Image"
                    }
                }
            },
            "required": [
                "header",
                "slideImages",
                "futurePlans"
            ]
        },
        "Image": {
            "title": "Image",
            "type": "string",
            "oneOf": [{"pattern": "^img/.{0,}\\.jpg$"},
                      {"pattern": "^img/.{0,}\\.png$"}]
        }
    }
}
